url,title,text
http://www2.sas.com/proceedings/sugi22/STATS/PAPER267.PDF,Introduction to Building a Linear Regression Model,"The <b>Goodyear Tire &amp; Rubber Company</b>, Akron Ohio ... analysts who have limited <br>
exposure to building ..... If multicollinearity exists, you can try: <b>changing</b> the."
https://cleantechnica.com/2017/09/09/goodyear-tesloop-partnering-intelligent-tire-testing/,"Goodyear & Tesloop Partnering For ""Intelligent Tire"" Testing ...","... …Goodyear has been working with Tesloop since January 2017 to ... Tags: <br>
<b>Goodyear Tire &amp; Rubber Company</b>, intelligent tires, smart tires, Tesloop ... 7 <br>
European Countries Step Up Fight Against <b>Climate Change</b>, Call For&nbsp;..."
https://gardencollage.com/wander/gardens-parks/garden-akron-ohio-worthy-lebron/,"This Garden in Akron, Ohio is Worthy of LeBron - Garden Collage ...","... F.A. Seiberling, the co-founder of the <b>Goodyear Tire &amp; Rubber Company</b>, and his <br>
wife, Gertrude, always wanted their magnificent Tudor Revival&nbsp;..."
http://www.justtires.com/service/Services/Batteries/pc/701/155142.uts,Car Battery Replace or Recharge,"Schedule an appointment for Batteries today at a Just Tires Store in your area. ... <br>
If you live in a very hot or cold <b>climate</b> or want your battery to run a lot of .... The <br>
<b>Goodyear Tire &amp; Rubber Company</b>, Tire Distributors &amp; Manufacturers, Akron, OH."
https://stocknewsjournal.com/2018/04/27/how-to-trade-these-stock-after-an-unavoidable-selloff-the-goodyear-tire-rubber-company-gt-the-bank-of-new-york-mellon-corporation-bk/,The Goodyear Tire & Rubber Company,"... How to Trade these Stock After an unavoidable Selloff: The <b>Goodyear Tire &amp;</b> <br>
<b>Rubber Company</b> (GT), The Bank of New York Mellon Corporation&nbsp;..."
http://wnba-nyc.org/pay-equity-is-less-than/,Progress is waning when it comes to pay equity.,"... <b>Goodyear Tire &amp; Rubber Co</b>., Inc., 550 U.S. 618 (2007)—a decision that ... Poets <br>
of the Anthropocene: When Ecopoets Think <b>Climate Change</b>."
http://www.sustainablebrands.com/news_and_views/waste_not/sustainable_brands/goodyear_turning_rice_husk_waste_fuel-efficient_tire_tre,Goodyear Turning Rice Husk Waste Into Fuel-Efficient Tire Treads ...,"... The <b>Goodyear Tire &amp; Rubber Company</b> announced Monday it will begin using ... <br>
Nations, and disposing of the rice husks is an <b>environmental</b> challenge. ... <br>
including soybean oil, to <b>replace</b> petroleum-based materials in tires.”."
https://gov.goodyear.com/docs/police/bulletins/psb2016-08-tire-repair-auto-lt-truck.pdf,Proper Puncture Repair Procedures For Passenger & Light Truck Tires,"THE <b>GOODYEAR TIRE &amp; RUBBER COMPANY</b> &amp; GOODYEAR CANADA INC. <br>
PRODUCT SERVICE DEPARTMENT. Page 1 of 2. Product Service Bulletin."
https://www.iccr.org/iccrs-shareholder-resolutions,ICCR's Shareholder Resolutions | ICCR (Interfaith Center on ...,"Trucost: taking the environment into account. 2018 Shareholder Resolutions / <br>
Environmental Performance by Sector .... Bank of New York Mellon Corporation (<br>
BK), Proxy Voting Policies - <b>Climate Change</b> .... <b>Goodyear Tire &amp; Rubber Co</b>."
http://ideaexchange.uakron.edu/cgi/viewcontent.cgi?article=1390&context=honors_research_projects,Honors Project- Goodyear,"... commercializing green technologies would <b>change</b> the perception of the .... <br>
<b>environment</b>, we can assume that if soybean <b>tires</b> were at a ..... The <b>Goodyear</b> <br>
<b>Tire</b> and <b>Rubber Company</b> is using this framework to their advantage."
