url,title,text
http://fortune.com/2017/09/25/indra-nooyi-pepsi-mark-bertolini-aetna/,PepsiCo CEO Indra Nooyi: Millennials Want More Than a Paycheck ...,"... <b>PepsiCo</b> CEO Indra Nooyi and Aetna CEO Mark Bertolini discussed the ... Alan <br>
Murray, Time <b>Inc</b>.&#39;s Chief Content Officer, noted that it is far more ... political topics<br>
—from <b>climate change</b> to nationwide protests—today than it was&nbsp;..."
https://www.ran.org/,Rainforest Action Network,"Rainforest Action Network preserves forests, protects the climate and ... Activists <br>
Disrupt <b>PepsiCo</b> NYC Office &middot; Mar 28, 2018. Read More &middot; Houston: Hurt by the <br>
Causes and Symptoms of <b>Climate Change</b> - A Banking on ... Rainforest Action <br>
Network is a nonprofit, tax-exempt 501(c)(3) <b>corporation</b> (tax ID number 94-<br>
3045180)."
http://www.wri.org/news/2014/07/release-strengthening-community-forest-rights-critical-tool-fight-climate-change-says,RELEASE: Strengthening Community Forest Rights is Critical Tool ...,"... The report, called “Securing Rights, Combating <b>Climate Change</b>: How .... climate.<br>
” Robert ter Kuile, Senior Director Sustainability, <b>PepsiCo</b>, <b>Inc</b>:."
https://thebossmagazine.com/pepsi-major-sustainability-goals-2025/,BOSS Magazine | Pepsi Sets Major Sustainability Goals For 2025,"... Earlier this month, <b>PepsiCo</b>, <b>Inc</b>. announced their agreement with ... “The threat of <br>
<b>climate change</b> calls for governments and businesses to&nbsp;..."
https://www.facebook.com/pepsi/,Pepsi - Home | Facebook,"<b>Pepsi</b>. 37M likes. Welcome To <b>Pepsi</b> Global! ... Fires lit for palm oil are harming <br>
communities, rainforests, the planet, and worsening <b>climate change</b>. Cut Conflict<br>
&nbsp;..."
https://www.greenbiz.com/blog/2010/04/09/why-pepsico-changing-renewable-strategy,Why PepsiCo is Changing its Renewable Energy Strategy | GreenBiz,"... This month, the <b>Environmental</b> Protection Agency will release its quarterly Green <br>
Power Purchasers list. After a long run as a top purchaser of&nbsp;..."
http://www.csrwire.com/members/10363-pepsico,"PepsiCo - Corporate Social Responsibility News, Reports and ...","Corporate Social Responsibility profile of <b>PepsiCo</b> ... Press Release <b>PepsiCo</b> <br>
Embraces Science-based Targets in the Fight Against <b>Climate Change</b>."
https://www.sec.gov/Archives/edgar/data/77476/000007747616000066/pepsico201510-k.htm,10-K,"Portions of the Proxy Statement relating to <b>PepsiCo</b>, <b>Inc</b>.&#39;s 2016 Annual Meeting <br>
of ..... Success in this competitive <b>environment</b> is dependent on effective <br>
promotion of .... Risk Factors” below “<b>Changes</b> in, or failure to comply with, laws <br>
and&nbsp;..."
https://grist.org/article/nestle-pepsico-and-other-big-corporations-promised-to-protect-forests-whos-following-through/,"Nestle, PepsiCo, and other big corporations promised to protect ...","... <b>Climate Change</b>. Nestle, <b>PepsiCo</b>, and other big corporations promised to protect <br>
forests. Who&#39;s following through? By Nathanael Johnson on&nbsp;..."
http://www.pionline.com/article/20170927/ONLINE/170929910/commentary-in-a-changing-world-investors-must-cut-exposure-to-water-risk,"Commentary: In a changing world, investors must cut exposure to ...","... ​<b>Climate change</b> didn&#39;t cause the recent monstrous hurricanes, but a ... General <br>
Mills <b>Inc</b>., Nestle, <b>PepsiCo Inc</b>. and Unilever — the majority&nbsp;..."
