url,title,text
https://climatechangelive.org/index.php?pid=176,ClimateChangeLIVE - Tech Tips & Requirements,"A 233 megahertz (MHz) processor, such as an Intel Pentium II or <b>Advanced Micro</b> <br>
<b>Devices</b> (<b>AMD</b>) processor. A 1.5 gigahertz (GHz) processor or faster. RAM."
https://finance.yahoo.com/news/why-advanced-micro-devices-amd-230911893.html,Why Advanced Micro Devices (AMD) Stock Keeps Falling,"... Shares of <b>Advanced Micro Devices</b> (<b>AMD</b>) sunk 1.6% on ... “The cryptocurrency <br>
market is unstable and demand could <b>change</b> quickly,” <b>AMD</b>&nbsp;..."
https://climatechangelive.org/index.php?pid=169,ClimateChangeLIVE - How to Participate,"meet NATIONAL SCIENCE STANDARDS about <b>climate change</b>; get students ... <br>
such as an Intel Pentium II or <b>Advanced Micro Devices</b> ( <b>AMD</b> ) processor."
https://www.thenational.ae/business/markets/mubadala-investment-sells-shares-in-amd-1.616794,Mubadala Investment sells shares in AMD - The National,"... Mubadala Investment sold shares in the American semiconductor company, <br>
<b>Advanced Micro Devices</b> (<b>AMD</b>), the company said on Friday."
https://www.nasdaq.com/symbol/amd/after-hours,"Advanced Micro Devices, Inc. (AMD) After Hours Trading - NASDAQ ...","<b>Advanced Micro Devices</b>, Inc. (<b>AMD</b>) After Hours Trading - View free After Hours <br>
stock trades at ... *Delayed - data as of 05/18/2018 19:59:15 - Find a broker to <br>
begin trading <b>AMD</b> now .... Stock prices may also move more quickly in this <br>
<b>environment</b>. ... You have selected to <b>change</b> your default setting for the Quote <br>
Search."
https://www.linkedin.com/in/heather-o-cleirigh-9128b34,"Heather O'Cleirigh - Global Health, Safety, Security and ...","Global Health, Safety, Security and Environmental Manager at <b>AMD</b> ... <b>Advanced</b> <br>
<b>Micro Devices</b>, Inc.,; Energy and Environmental Consulting Services ... auditing, <br>
air, waste, water and energy management, and <b>climate change</b> mitigation."
http://www.nytimes.com/topic/company/advanced-micro-devices-inc,Advanced Micro Devices Inc. - The New York Times,"News about <b>Advanced Micro Devices</b> Inc. Commentary and archival ... LAST, <br>
<b>CHANGE</b>, VOLUME ... The chief executive of <b>AMD</b> says that teams are often <br>
capable of achieving more than they believe they can. ..... <b>Climate</b> &middot; Space &amp; <br>
Cosmos."
https://finance.yahoo.com/quote/AMD/,"AMD 13.00 0.18 1.40% : Advanced Micro Devices, Inc. - Yahoo ...","View the basic <b>AMD</b> stock chart on Yahoo Finance. <b>Change</b> the date range, chart <br>
type and compare <b>Advanced Micro Devices</b>, Inc. against other companies."
https://www.economist.com/topics/advanced-micro-devices,"Advanced Micro Devices | Economist - World News, Politics ...","<b>Advanced Micro Devices</b> ... That&#39;s because the business is changing ... Intel and <br>
<b>AMD</b> end their legal disputes, but regulators may not be placated ... 2Daily chart: <br>
<b>Climate change</b> will affect developing countries more than rich ones &middot; 3Iran and&nbsp;..."
https://www.huffingtonpost.com/tim-mohin/power-pollution-and-the-i_b_1966893.html,"Power, Pollution and the Internet: Right Discussion, Wrong ...","... The <b>AMD</b> SeaMicro server represents the cutting edge in energy efficient ... to <br>
education, to forecasting the effects of <b>climate change</b> and more. ... Director of <br>
Corporate Responsibility for <b>Advanced Micro Devices</b> (<b>AMD</b>) and the&nbsp;..."
