url,title,text
https://science2017.globalchange.gov/downloads/CSSR2017_FullReport.pdf,Climate Assessment,"USGCRP, 2017: <b>Climate</b> Science Special Report: Fourth National <b>Climate</b> <br>
Assessment, Volume I [Wuebbles,. D.J., D.W. Fahey, K.A. Hibbard, D.J. Dokken, <br>
B.C. Stewart, and T.K. Maycock (<b>eds</b>.)]. U.S. Global ... Jeff R. Arnold, U.S. Army <br>
<b>Corps</b> of Engineers ... Justin Goldstein, U.S. Global <b>Change</b> Research Program. <br>
– ICF."
https://www.fs.usda.gov/treesearch/pubs/37406,Scanning the conservation horizon: A guide to climate change ...,"Rapid <b>climate change</b> is the defining conservation issue of our generation. The <br>
effects of ... Citation. Glick, Patty; Stein, Bruce A.; Edelson, Naomi A., <b>eds</b>. 2011."
http://journals.sagepub.com/doi/abs/10.1177/0002764212469800,Conservative Columnists' Dismissal of Global Warming and ...,"The conservative “echo chamber” is a crucial element of the <b>climate change</b> <br>
denial machine. ... We analyze 203 opinion editorials (“op-<b>eds</b>”) written by 80 <br>
different columnists published from ... <b>Corporate</b> hijacking of the greenhouse <br>
debate."
https://www.nap.edu/read/12782/chapter/22,References | Advancing the Science of Climate Change | The ...,"Read chapter References: <b>Climate change</b> is occurring, is caused largely by ... <br>
Adger, W. N., J. Paavola, S. Huq, and M. J. Mace, <b>eds</b>. 2006 ..... CNA <b>Corporation</b>."
https://www.edf.org/,Environmental Defense Fund,"Stabilizing the <b>climate</b>EDF&#39;s bold plan to curb carbon emissions globally, with <br>
solutions ... products through chemical policy reform and <b>corporate</b> partnerships."
https://www.fs.usda.gov/treesearch/pubs/47131,Climate change vulnerability and adaptation in the North Cascades ...,"<b>Climate change</b> vulnerability and adaptation in the North Cascades region, <br>
Washington .... Raymond, Crystal L.; Peterson, David L.; Rochefort, Regina M., <br>
<b>eds</b>."
https://www.washingtonpost.com/news/in-theory/wp/2016/01/06/america-has-been-lied-to-about-climate-change/,America has been duped on climate change - The Washington Post,"... For years, ExxonMobil had been a participant in public efforts to sow doubt about <br>
<b>climate change</b>. Yet at at the same time, the <b>corporation</b> was&nbsp;..."
http://www.publish.csiro.au/rj/rj08068,Climate change impacts on northern Australian rangeland livestock ...,"We report the results of a sensitivity study of <b>climate change</b> impacts on forage .... <br>
(<b>Eds</b> F. P. O&#39;Mara, R. J. Wilkins, L. &#39;t Mannetje, D. K. Lovett, P. A. M. Rogers and <br>
.... Final Report for Rural Industries and Research Development <b>Corporation</b>&nbsp;..."
https://www.thecrimson.com/article/2018/3/28/taylor-stop-funding-climate-change/,It's Time for Harvard to Stop Funding Climate Change | Opinion | The ...,"... It&#39;s Time for Harvard to Stop Funding <b>Climate Change</b> ... I call upon the next <br>
University president, and the Harvard <b>Corporation</b> members who&nbsp;..."
https://www.wilsoncenter.org/event/national-security-and-the-accelerating-risks-climate-change,National Security and the Accelerating Risks of Climate Change ...,"... <b>Climate change</b> poses a serious threat to U.S. national security and is ... CNA <br>
<b>Corporation&#39;s</b> Military Advisory Board for the launch of National&nbsp;..."
