url,title,text
http://there100.org/companies,Companies - RE100,"Recognising the business risks associated with <b>climate change</b>, Swiss Re is <br>
motivated to drive a low carbon economy and has a goal to use 100% renewable <br>
... <b>BMW</b> is committed to procuring 100% of electricity from renewable sources for <br>
its operations and has an interim target to source more than two thirds of its&nbsp;..."
http://www.motorcycle-usa.com/2015/12/article/american-honda-bmw-group-sign-climate-pledge/,American Honda & BMW Group Sign Climate Pledge - Motorcycle ...,"... This week, 150 Heads of State and Government have convened in Paris, France, <br>
at the 21st Conference of the Parties to the United Nations Framework <br>
Convention on <b>Climate Change</b>. The goal of the Conference is to “reach a new <br>
universal climate agreement that is applicable to all,” according to the&nbsp;..."
http://envfor.nic.in/content/gsr-343e-28-03-2016-bio-medical-waste-management-rules2016,GSR 343(E). [28-03-2016] : Bio-Medical Waste Management Rules ...,"... The Ministry of Environment &amp; Forests (MoEF) is the nodal agency in the <br>
administrative structure of the Central Government for the planning, promotion, co<br>
-ordination and overseeing the implementation of India&#39;s environmental and <br>
forestry policies and programmes."
https://www.unece.org/fileadmin/DAM/env/water/publications/documents/Guidance_water_climate.pdf,Guidance on Water and Adaptation to Climate Change,"/water/. Economic Commission for Europe. Convention on the Protection and Use <br>
of Transboundary. Watercourses and International Lakes. Guidance on Water <br>
and. Adaptation to <b>Climate Change</b>. EC. E. Gu id a n ce o n W a ter a n d A da <br>
ptat io n t o. C limat e C hange&nbsp;..."
https://www.sfchronicle.com/bayarea/article/Climate-change-law-has-reshaped-California-in-10-9277756.php,Climate change law has reshaped California in 10 years - San ...,"... The carpool lane has turned into a parade of electric vehicles, from Nissan, <b>BMW</b>, <br>
Fiat and yes, Tesla, whose factory lies just east of the freeway. Regulators at the <br>
California Air Resources Board took a pollution-cutting program that dated back <br>
to 1990 and used it to force automakers to sell zero-emission&nbsp;..."
https://www.environmentalleader.com/2014/01/microsoft-bmw-among-top-supply-chain-climate-performers/,"Microsoft, BMW Among Top Supply Chain Climate Performers ...","... Air France, <b>BMW</b>, Hewlett-Packard and Microsoft are among 79 companies <br>
leading in <b>climate change</b> performance, according to a new evaluation and <br>
benchmarking tool created for CDP supply chain members and suppliers. The <br>
Supplier Climate Performance Leadership Index, which was compiled by&nbsp;..."
https://www.ucsusa.org/sites/default/files/attach/2015/07/Climate-Deception-Dossier-7_GCC-Climate-Primer.pdf,Deception Dossier #7: The Global Climate Coalition's 1995 Primer ...,"<b>BMW</b>. Treasurer .,J.AMESTOY. Mazda. <b>BMW</b> c ••woo. Flat. Honda. Hyundal lauzu<br>
. TO: FROM: RE: TECH-96-29. 1/18/96. AIAM Technical Committee. Gregory J. <br>
Dana. Vice President and Technical Director. GLOBAL CLIMATE COALITION-(<br>
GCC)· Primer on. <b>Climate Change</b> Science· Final Draft. Kia. Land Rover. Mazda."
https://arstechnica.com/cars/2017/12/bmw-i-is-how-the-ultimate-driving-machine-is-adapting-to-the-future/,"BMW i: An electric, autonomous, vehicular “Skunk Works”? | Ars ...","... ... the line-up at this year&#39;s LA Auto Show, along with a slightly souped-up version <br>
of its urban EV, the i3S. With these (and the self-driving iNEXT, due in 2021), <br>
<b>BMW</b> is grappling with mobility, the brave new transport future that some believe <br>
will save us from the ravages of car crashes and <b>climate change</b>."
http://www.imo.org/en/MediaCentre/PressBriefings/Pages/17-MEPC-71.aspx,International Maritime Organization moves ahead with oceans and ...,"... This work is helping IMO to fulfil its mandate to protect oceans and human health <br>
and to mitigate <b>climate change</b>, in line with the UN Sustainable Development <br>
Goals (SDGs), particularly SDG 14 (oceans) and SDG 13 (<b>climate change</b>). <br>
Ballast Water Management Convention clarity. The MEPC agreed a&nbsp;..."
http://www.thedetroitbureau.com/2017/10/toyota-bmw-get-high-marks-for-environmental-practices/,"Toyota, BMW Get High Marks for Environmental Practices ...","... Toyota Motor Corp. and <b>BMW</b> have earned A Grades from the Carbon Disclosure <br>
Project for their efforts to reduce <b>climate change</b>. For more, go to <br>
TheDetroitBureau.com."
